"FileName","RelationType","Entity1Mention","Entity1Type","Entity2Mention","Entity2Type","Context"
"ESET_Operation_Ghost_Dukes","indicates","Dropbox","PRODUCT","one","CARDINAL","We only found one payload , but we can not be certain that others are not deployed in the wild . The payload : a fileless , Dropbox - controlled backdoor The payload is a backdoor that resides in memory only , and that uses Dropbox as its C&C server . "
"PKPLUG_ Chinese Cyber Espionage Group Attacking Asia","hasattacklocation","Beijing","GPE","the People¡¯s Republic of China","GPE","Tibet and Xinjiang are autonomous regions ( AR ) of China that tend to be classi.ed by China¡¯s ethnic minorities , granted the ability to govern themselves but ultimately answering to the People¡¯s Republic of China ( PRC ) . Tibet and Xinjiang are the only ARs , from .ve , where the ethnic group maintains a majority over other populations . Most , if not all , of the seven countries or regions , are involved in some way with Beijing¡¯s Belt and Road Initiative ( BRI ) designed to connect 71 countries across Southeast Asia to Eastern Europe and Africa . "
"New Network Vermin from OceanLotus","hasproduct","Cylance","ORG","Ratsnif","PRODUCT","The SpyRATs of OceanLotus ; OceanLotus APT Group Leveraging Steganography ) is using a suite of remote access trojans dubbed "" Ratsnif "" to leverage new network attack capabilities . Blackberry Cylance threat researchers have analyzed the Ratsnif trojans , which offer a veritable swiss - army knife of network attack techniques . "
"Operation_Sheep","hasattacktime","Chandashi","ORG","September 2018 to January 2019","DATE","In order to understand SWAnalytics¡¯ impact , we turned to public download volume data available on Chandashi , one of the app store optimization vendors specialized in Chinese mobile application markets . We derived a monthly new installation volume of six popular applications of interest . Data points span from September 2018 to January 2019 where we observed over 17 million downloads in just .ve months . "
"APT-C-09","hasattacklocation","Bitter","ORG","China","GPE","Considering APT - C-09 , Bitter and Donot have carried out targeted attacks against China , we must take actions in advance and keep a close eye on their recent activities . "
"Emissary Panda Attacks Middle East Government Sharepoint Servers","hasattacktime","two","CARDINAL","April 16, 2019","DATE","The timeline shows three main clusters of activity across the three webshells , with activity occurring on two separate webshells ( green and orange ) within a very small window of time on April 2 , 2019 and the activity involving the third webshell two weeks later on April 16 , 2019 . "
"DarkHydrus delivers new Trojan that can use Google Drive for C2 communications","hasproduct","RogueRobin","ORG","PowerShell","PRODUCT","The similarities between the PowerShell and C # variants of RogueRobin suggests that the DarkHydrus group ported their code to a compiled variant . "
"China Chopper still active 9 years later","hasproduct","China Chopper","ORG","Apache","PRODUCT","In our research , we discovered both Internet Information Services ( IIS ) and Apache web servers compromised with China Chopper web shells . "
"PKPLUG_ Chinese Cyber Espionage Group Attacking Asia","hasproduct","Viewer","ORG","Android","PRODUCT","Other TTPs are described in the STIX 2.0 package and presented in the Viewer . The use of Android malware shows intent to get at targets where perhaps traditional computers , operating systems and ways of communicating are different from previous targets . "
"ESET-LightNeuron","hasattacklocation","Snake","ORG","Central Asia","LOC","29 1 .. EXECUTIVE SUMMARY Turla , also known as Snake , is one of oldest , still - active cyberespionage groups , with more than a decade of experience . Its operators mainly focus on high - profile targets such as governments and diplomatic entities in Europe , Central Asia and the Middle East . "
"APT10 Targeted Norwegian MSP and US Companies in Sustained Campaign","hasattacklocation","APT3","ORG","Switzerland","GPE","Our research from 2017 concluded that Guangdong ITSEC ( and therefore the MSS ) directed the activities of a company named Boyusec , which was identified as a shell company for APT3 . Suspected Tianjin State Security Bureau headquarters . ( Source : IntrusionTruth ) The December APT10 indictment noted that the group¡¯s malicious activities breached at least 45 companies and managed service providers in 12 countries , including Brazil , Canada , Finland , France , Germany , India , Japan , Sweden , Switzerland , the United Arab Emirates , the United Kingdom , and the United States . "
"APT10 Targeted Norwegian MSP and US Companies in Sustained Campaign","hasattacklocation","Citrix","ORG","China","GPE","The firm has a dedicated China practice aimed at assisting Chinese companies entering the U.S. market . Rapid7¡¯s investigation revealed the law firm was first targeted in late 2017 , followed by the apparel company a few months later , and finally , the Visma attack in August 2018 . In one of the attacks , Rapid7 identified the attackers escaping a Citrix application in order to run the payload script on the victim desktop . "
"Ransomware, Trojan and Miner together against “PIK-Group”","indicates","¡¯s a Miner","PRODUCT","second","ORDINAL","The second installed module ( 37ED0C97.exe ) is well - known piece of software as well . It¡¯s a Miner called nheqminer . "
"ESET_Attor","hasproduct","Notepad","ORG","Powerpoint","PRODUCT","Email services ( Gmail , AOL Mail , Hotmail , Hotbox , Webmail , Yahoo ! Mail ) . Office software ( MS Word , Powerpoint , Excel , Visio , Notepad , Notepad++ , Wordpad ) . Archiving utilities ( WinRAR , WinZip , Hamster ) . "
"Registers as “Default Print Monitor”, but is a malicious downloader. Meet DePriMon","hasproduct","MITRE","ORG","¡°Port Monitors¡±","PRODUCT","In principle , it is described in the MITRE ATT&CK taxonomy as ¡ ° Port Monitors¡± , under both Persistence and Privilege Escalation tactics . "
"Chafer used Remexi malware to spy on Iran-based foreign diplomatic entities","hasvulnerability","Windows","PRODUCT","Microsoft Background Intelligent Transfer Service","ORG","The attackers rely heavily on Microsoft technologies on both the client and server sides : the Trojan uses standard Windows utilities like Microsoft Background Intelligent Transfer Service ( BITS ) bitsadmin.exe to receive commands and exfiltrate data . "
"Chinese_APT_Operation_LagTime_IT","indicates","Excel","PRODUCT","four","CARDINAL","The .rst four of these processes are associated with Microsoft Word , Excel , and PowerPoint exploits , as well as the Equation Editor exploit used by the initial malicious RTF in this campaign . "
"BRONZE PRESIDENT Targets NGOs","hasattacklocation","BRONZE","ORG","South","LOC","Additionally , CTU researchers have observed evidence of BRONZE PRESIDENT targeting political and law enforcement organizations in countries adjacent to the PRC , including Mongolia and India . Some of the group 's phishing lures suggest an interest in national security , humanitarian , and law enforcement organizations in the East , South , and Southeast Asia ( see Figure 1 ) . "
"cta-2019-0206","hasproduct","Visma","ORG","Trochilus","PRODUCT","During the Visma intrusion , APT10 deployed their Trochilus malware with command and control ( C2 ) communications encrypted using both RC4 and Salsa20 streaming ciphers rather than the typically observed RC4 variant . "
"New_Destructive_Wiper_ZeroCleare_Final_","hasproduct","VirtualBox","ORG","VBoxDrv.sys","PRODUCT","The soy.exe sample then writes the decoded content to a 64 - bit VirtualBox VBoxDrv.sys driver file called saddrv.sys2 , which is known to have privilege escalation and arbitrary code execution vulnerabilities . "
"Latest Spam Campaigns from TA505 Now Using New Malware Tools Gelup and FlowerPippi","hasattacklocation","Gelup","PERSON","Argentina","GPE","Screenshot of a spam email targeting Japan , the Philippines , and Argentina ( top ) , and another thattargets South Korea , which directly uses or embeds a malicious URL instead of an attachment ( bottom ) Gelup Downloader Malware and FlowerPippi Backdoor In the campaign that targeted Japan , Philippines , and Argentina on June 20 , we found what seems to be anew , undisclosed malware , which we named Gelup . "
"Latest Spam Campaigns from TA505 Now Using New Malware Tools Gelup and FlowerPippi","hasattacklocation","URLsto","ORG","Philippines","GPE","This gave us the opportunity to observe TA505¡¯s method of using URLsto deliver the entry point malware . Figure 8 . Screenshot of a spam email targeting Japan , the Philippines , and Argentina ( top ) , and another thattargets South Korea , which directly uses or embeds a malicious URL instead of an attachment ( bottom ) Gelup Downloader Malware and FlowerPippi Backdoor "
"ESET_Operation_Ghost_Dukes","hascharacteristics","Operation Ghost","WORK_OF_ART","4","CARDINAL","Figure 4 // Reddit post containing an encoded C&C URL Figure 5 presents the timeline of Operation Ghost . "
"Emissary Panda Attacks Middle East Government Sharepoint Servers","indicates","SharePoint","PRODUCT","two","CARDINAL","In April 2019 , Unit 42 observed the Emissary Panda ( AKA APT27 , TG-3390 , Bronze Union , Lucky Mouse ) threat group installing webshells on Sharepoint servers to compromise Government Organizations of two different countries in the Middle East . We believe the adversary exploited a recently patched vulnerability in Microsoft SharePoint tracked by CVE-2019 - 0604 , which is a remote code execution vulnerability used to compromise the server and eventually install a webshell . "
"Operation-ENDTRADE-TICK-s-Multi-Stage-Backdoors-for-Attacking-Industries-and-Stealing-Classified-Data","hasproduct","API)","ORG","CreatePipe","PRODUCT","Further , by adding or using the CreatePipe application program interface ( API ) , BBK can add a sub - process for execution via cmd.exe . "
"CyberThreatIntel_Malware analysis 20-08-19.md at master · StrangerealIntel_CyberThreatIntel","hasattacklocation","Chinese","NORP","Pakistan","GPE","The information put in the domain register has a Chinese provenance . This operation is done by the Chinese APT group(s ) after the visit of the U.S.National Security Advisor in Mongolia about the national security concept . The document are a compiled of muliple documents about the national securityconcept available on the web . The others samples are leurs against Jaish group who have recently in.ltrateKashmir . Pakistan and China cooperate against the Jaish Association who haveincreased since the attack foiled in November 2018 against the Chinese consulate . "
"ESET_Attor","hasproduct","Maxthon","ORG","Internet Explorer","PRODUCT","Targeted are mostly web browsers , including all major ( Firefox , Opera , Chrome , Safari , Internet Explorer ) and a few less popular ( Maxthon , Avant , SeaMonkey ) ones . "
"CyberInt_Legit Remote Access Tools Turn Into Threat Actors' Tools_Report","hasattacklocation","TektonIT¡¯","ORG","India","GPE","TektonIT¡¯. Based on this continued analysis , an additional campaign targeting financial institutions in Chile , India , Italy , Malawi , Pakistan and South Korea was identified as previously conducted during December 2018 . "
"Operation_Sheep","hasattacklocation","Alipay","ORG","South East Asia","LOC","When receivers click on these referral links , both the sender and receiver receives a small amount of credit in their Alipay accounts . In 2019 new year trend predictions , multiple media outlets such as the BBC¡¯s ¡ ® Business Matters¡¯ program and Forbes mentioned the online retail sector could expect great competition . In South East Asia alone , for example , Amazon , Alibaba backed Lazada and Shopee will each directly face - off against each other in regional markets . "
"CyberInt_Legit Remote Access Tools Turn Into Threat Actors' Tools_Report","hasproduct","Relay Server","ORG","the ¡®Relay Server¡¯","PRODUCT","This RU Server supports three roles that can be deployed individually or together , although only one , the ¡ ® Relay Server¡¯ , would likely be utilised in nefarious implementations . This Relay Server acts as an intermediary with ¡ ® compromised¡¯ RMS clients calling - home to it and identifying themselves with their ¡ ® Internet - ID¡¯ facilitating communications that allow firewalls and NAT devices to be bypassed . "
"New_Destructive_Wiper_ZeroCleare_Final_","hasproduct","ZeroCleare","ORG","EldoS RawDisk","PRODUCT","Since ZeroCleare relies on the EldoS RawDisk driver , which is not a signed driver and would therefore not run by default , the attackers use an intermediary file named soy.exe to perform the workaround . "
"FIN7.5_ the infamous cybercrime rig “FIN7” continues its activities","hasproduct","Twitter","ORG","C2","PRODUCT","This error allowed us to follow the infrastructure week by week , until an individual pushed on Twitter the heuristic to track their C2 at the end of December 2018 . "
"APT10 Targeted Norwegian MSP and US Companies in Sustained Campaign","hasattacklocation","Boyusec","ORG","India","GPE","Our research from 2017 concluded that Guangdong ITSEC ( and therefore the MSS ) directed the activities of a company named Boyusec , which was identified as a shell company for APT3 . Suspected Tianjin State Security Bureau headquarters . ( Source : IntrusionTruth ) The December APT10 indictment noted that the group¡¯s malicious activities breached at least 45 companies and managed service providers in 12 countries , including Brazil , Canada , Finland , France , Germany , India , Japan , Sweden , Switzerland , the United Arab Emirates , the United Kingdom , and the United States . "
"huge-fan-of-your-work-intelligence-report","hasproduct","YU","ORG","IsSpace","PRODUCT","Notably , LIU also appeared to broker the use of Sakula from its developer YU , as well as the malware IsSpace ( associated with SAMURAI PANDA ) from its likely developer ZHUANG.20 LIU and YU¡¯s conversations about Sakula would be a critical factor in tying all of this disparate activity together as Sakula was believed to be unique to the JSSD operators and could be used to tie several aerospace intrusion operations into a single , long - running campaign . "
"Chinese_APT_Operation_LagTime_IT","hasproduct","Microsoft Word","ORG","PowerPoint","PRODUCT","The .rst four of these processes are associated with Microsoft Word , Excel , and PowerPoint exploits , as well as the Equation Editor exploit used by the initial malicious RTF in this campaign . "
"ESET_Okrum_and_Ketrican","indicates","Ketrican","PRODUCT","two","CARDINAL","In March 2019 , we detected two new Ketrican samples , one of which was similar to the 2018 Ketrican backdoor , and the other that has evolved from it . "
"New_Destructive_Wiper_ZeroCleare_Final_","hasattacklocation","Shamoon","PERSON","Iran","GPE","These tactics resemble the way Shamoon was launched in attacks on Arabian Gulf targets in 2018 . X - Force IRIS assesses that the ITG13 threat group , also known as APT34 / OilRig , and at least one other group , likely based out of Iran , collaborated on the destructive portion of the attack . "
"Latest Spam Campaigns from TA505 Now Using New Malware Tools Gelup and FlowerPippi","hasattacklocation","TA505","ORG","Japan,the Philippines","GPE","Another new malware we found that TA505 is using in their campaigns last June 20 against targets in Japan , the Philippines , and Argentina is FlowerPippi . "
"Newly identified StrongPity operations _ AT&T Alien Labs","hasattacklocation","WinBox","ORG","Belgium","GPE","We have also identified StrongPity deploying malicious versions of the WinBox router management software , WinRAR , and other trusted software to compromise targets . Background StrongPity was first publicly reported on in October 2016 with details on attacks against users in Belgium and Italy in mid-2016 . "
"PKPLUG_ Chinese Cyber Espionage Group Attacking Asia","hasproduct","Microsoft","ORG","Farseer","PRODUCT","A VBScript component is used , via a registry persistence hook , to launch the Microsoft executable and the Farseer payload during the user login process . "
"PKPLUG_ Chinese Cyber Espionage Group Attacking Asia","hasattacklocation","Beijing","GPE","Tibet","GPE","Tibet and Xinjiang are the only ARs , from .ve , where the ethnic group maintains a majority over other populations . Most , if not all , of the seven countries or regions , are involved in some way with Beijing¡¯s Belt and Road Initiative ( BRI ) designed to connect 71 countries across Southeast Asia to Eastern Europe and Africa . "
"Obfuscation Tools Found in the Capesand Exploit Kit Possibly Used in “KurdishCoder” Campaign","hasattacklocation","NABU","ORG","Canada","GPE","Stay Updated | For Business | Security Intelligence | About Trend Micro Asia Paci.c Region ( APAC ): Australia / New Zealand , ÖÐ¹ú , .±¾ , .... , Ì¨. Latin America Region ( LAR ): Brasil , M¨ ¦ xico North America Region ( NABU ): United States , Canada Europe , Middle East , & Africa Region ( EMEA ): France , Deutschland / .sterreich / Schweiz , Italia,§²§à§ã§ã§Ú§ñ , Espa.a , United Kingdom / Ireland "
"cta-2019-0206","hasattacklocation","APT10","ORG","the United Kingdom","GPE","The December APT10 indictment noted that the group¡¯s malicious activities breached at least 45 companies and managed service providers in 12 countries , including Brazil , Canada , Finland , France , Germany , India , Japan , Sweden , Switzerland , the United Arab Emirates , the United Kingdom , and the United States . "
"APT10 Targeted Norwegian MSP and US Companies in Sustained Campaign","hasattacklocation","APT3","ORG","Canada","GPE","Our research from 2017 concluded that Guangdong ITSEC ( and therefore the MSS ) directed the activities of a company named Boyusec , which was identified as a shell company for APT3 . Suspected Tianjin State Security Bureau headquarters . ( Source : IntrusionTruth ) The December APT10 indictment noted that the group¡¯s malicious activities breached at least 45 companies and managed service providers in 12 countries , including Brazil , Canada , Finland , France , Germany , India , Japan , Sweden , Switzerland , the United Arab Emirates , the United Kingdom , and the United States . "
"Newly identified StrongPity operations _ AT&T Alien Labs","indicates","3PM UTC","TIME","eight hour","TIME","Based on this report¡¯s findings , all samples fit into a standard eight hour workday between 7AM UTC and 3PM UTC . "
"Emissary Panda Attacks Middle East Government Sharepoint Servers","hasproduct","TG-3390","ORG","Lucky Mouse","PRODUCT","In April 2019 , Unit 42 observed the Emissary Panda ( AKA APT27 , TG-3390 , Bronze Union , Lucky Mouse ) threat group installing webshells on Sharepoint servers to compromise Government Organizations of two different countries in the Middle East . "
"ESET_Okrum_and_Ketrican","hasattacklocation","Ke3chang","PERSON","Slovakia","GPE","In this paper we have documented the previously unknown malware , Okrum , detected by ESET in Slovakia , Belgium , Chile , Guatemala and Brazil , documented other suspected Ke3chang activity ( using the Ketrican and RoyalDNS malware families ) , and provided evidence that drives us to the conclusion that all of this is indeed the work of the Ke3chang threat actor . "
"ESET_Operation_Ghost_Dukes","hasattacktime","Dukes","PERSON","November 2018","DATE","Since then , most security experts have believed the Dukes went dark or completely changed their arsenal to pursue their mission . In November 2018 , a strange phishing campaign hit dozens of different organizations in the United States , including government agencies , and think tanks . "
"Bitter_APT_Malware_analysis","hasattacktime","Bitter","ORG","the last 2 weeks","DATE","This process graph represents the cyber kill chain of Bitter sample . Cyber Threat Intel Since the last 2 weeks , the C2 domain have changed ( .193 to .198 ) due to this are on the same subnet of the Verdina organization ( Bulgaria cloud provider ) . "
"ESET_Attor","hasproduct","Notepad","ORG","Excel","PRODUCT","Email services ( Gmail , AOL Mail , Hotmail , Hotbox , Webmail , Yahoo ! Mail ) . Office software ( MS Word , Powerpoint , Excel , Visio , Notepad , Notepad++ , Wordpad ) . Archiving utilities ( WinRAR , WinZip , Hamster ) . "
"blog_Sharpening the Machete","hasattacktime","Machete","ORG","every week","DATE","ESET has been tracking a new version of Machete ( the group¡¯s Python - based toolset ) that was .rst seen in April 2018 . While the main functionality of the backdoor remains the same as in previous versions , it has been extended with new features over the course of a year . Targets From the end of March up until the end of May 2019 , ESET researchers observed that there were more than 50 victimized computers actively communicating with the C&C server . This amounts to gigabytes of data being uploaded every week . "
"Palmerworm_ Espionage Gang Targets the Media, Finance, and Other Sectors _ Symantec Blogs","hasattacklocation","Palmerworm","ORG","China","GPE","The Threat Hunter Team at Symantec , a division of Broadcom ( NASDAQ:.AVGO ) , hasuncovered a new espionage campaign carried out by the Palmerworm group ( akaBlackTech ) involving a brand new suite of custom malware , targeting organizations inJapan , Taiwan , the U.S. , and China . The attacks occurred in 2019 and continued into 2020 , targeting.organizations in themedia , construction , engineering , electronics , and finance sectors . We observed the groupusing previously unseen malware in these attacks . Palmerworm uses a combination of custom malware , dual use tools , and living - off - the - land tactics in this campaign . "
"apt-c-36-continuous-attacks-targeting-colombian-government-institutions-and-corporations-en","hasattacklocation","RAT Company Description  Abbott Laboratories Chevron Energizer Holdings Inc.","ORG","the United States","GPE","Company Information in RAT Company Description Abbott Laboratories Chevron Energizer Holdings Inc. Progressive Corporation Simon Property Group Inc Sports Authority Inc Strongeagle , Lda . A healthcare company based in the United States A multinational energy company in the United States American battery manufacturer Auto insurance provider in America A commercial real estate company in America A sports goods retailer in the United States A company related to law suit in Portugal "
"OceanLotus Attacks to Indochinese Peninsula","hasproduct","Trojan","ORG","Windows","PRODUCT","The package name is "" tut_photoshop_scan_bank_id.rar "" From the sample trigger vulnerability extract .le , its name is called CocCocUpated . Exe COCCOC is a Vietnam was founded in 2013 as a new technology company , provides online Internet search engine services and browsers , the main language used in Vietnamese and English , the search service is Vietnam 's most mature , browser is based on Google Chromium development , support Windows , iOS platform . Through analysis , we found that it was the early Trojan framework of OceanLotus , and we also put it in the section of sample analysis for separate analysis . "
"Partners in crime_ North Koreans and elite Russian-speaking cybercriminals - Intel 471","hasproduct","Emotet","ORG","Emotet","PRODUCT","Whileincluding some unclear and unexplained links between TA505 and Emotet ( we¡¯ve neverseen TA505 use Emotet ) as well as TrickBot and Dridex ( see Annex 1 : Defining TA505),the report claims : DPRK threat actors have used a piece of ransomware called Hermes , which was soldin the underground ¡ ° for as little as $ 300 in 2017/2018¡± and Ryuk ransomwareshares most of its code with Hermes . "
"blog_Sharpening the Machete","indicates","Python","PRODUCT","six","CARDINAL","At the time of this publication , the latest change introduced six backdoor components , which are no longer py2exe executables . Python scripts for malicious components , an original executable for Python 2.7 , and all libraries used are packed into a self - extracting .le . "
"Buckeye_ Espionage Outfit Used Equation Group Tools Prior to Shadow Brokers Leak","hasproduct","Symantec","ORG","Windows","PRODUCT","a Windows zero - day vulnerability ( CVE-2019 - 0703 ) discovered by Symantec . The second Windows vulnerability ( CVE-2017 - 0143 ) was patched in March 2017 after it was discovered to have been used by two exploit tools¡ªEternalRomance and EternalSynergy¡ªthat were also released as part of the Shadow Brokers leak . "
"Iranian-Nation-State-APT-Leak-Analysis-and-Overview","hasattacklocation","Windows Mobile","ORG","Lebanon","GPE","Windows Mobile . Targeted entities The main targets of the group are . Governmental departments , agencies and offices . . Airlines . . Telecom companies . . IT companies . Targeted countries Asia Africa Other Sri Lanka Oman Egypt Fiji India Israel Morocco New Zealand UAE Turkey Ethiopia Australia Dubai Iraq Kenia Colombia Thailand Qatar South Africa Philippines Lebanon Mauritius Syria Malaysia Azerbaijan Indonesia Afghanistan Kyrgyzstan Pakistan "
"ESET_Operation_Ghost_Dukes","indicates","RC4","PRODUCT","eight","CARDINAL","To extract the payload from the file downloaded from the C&C server , PolyglotDuke will first decrypt the last eight bytes with RC4 using the same key as the one used for strings decryption . "
