"FileName","RelationType","Entity1Mention","Entity1Type","Entity2Mention","Entity2Type","Context"
"Dropping Anchor_ From a TrickBot Infection to the Discovery of the Anchor Malware","hasproduct","Microsoft","ORG","Word","PRODUCT","While at first glance these files can be mistaken for legitimate Microsoft Word files , a closer inspection of the file metadata indicates they are not associated with Microsoft Word , nor are they Microsoft Word document files . "
"GALLIUM_ Targeting global telecom","hasproduct","Microsoft","ORG","Edge","PRODUCT","Encourage users to use Microsoft Edge and other web browsers that support SmartScreen , which identi.es and blocks malicious websites , including phishing sites , scam sites , and sites that contain exploits and host malware . "
"New_Destructive_Wiper_ZeroCleare_Final_","hasproduct","Microsoft","ORG","Windows","PRODUCT","A batch file is a script file that¡¯s typical to DOS , OS/2 and Microsoft Windows . "
"GALLIUM_ Targeting global telecom","hasproduct","Microsoft","ORG","IIS","PRODUCT","In addition to standard China Chopper , GALLIUM has been observed using a native web shell for servers running Microsoft IIS that is based on the China Chopper web shell ; Microsoft has called this ¡ ° BlackMould.¡± "
"CyberThreatIntel_Malware analysis 20-08-19.md at master · StrangerealIntel_CyberThreatIntel","hasattacklocation","APT","ORG","China","GPE","This operation is done by the Chinese APT group(s ) after the visit of the U.S.National Security Advisor in Mongolia about the national security concept . The document are a compiled of muliple documents about the national securityconcept available on the web . The others samples are leurs against Jaish group who have recently in.ltrateKashmir . Pakistan and China cooperate against the Jaish Association who haveincreased since the attack foiled in November 2018 against the Chinese consulate . "
"New Fileless Botnet Novter Distributed by KovCoreG Malvertising Campaign","hasproduct","Adobe","ORG","Flash","PRODUCT","KovCoreG¡¯s attacks are socially engineered malvertisments that lure unwitting users into downloading asoftware package needed to update their supposedly out - of - date Adobe Flash application . "
"blog_new_muddywater_findings_uncovered","hasproduct","POWERSTATS","ORG","v3","PRODUCT","The campaign that used POWERSTATS v3 is not the only one we found with new tricks . "
"Operation_Kitty_Phishing","hasproduct","the Chrome Browser","ORG","Chrome Browser Password Stealer Module","PRODUCT","[ Code to store the victim¡¯s keyboard input value ] [ Keylogging information sent to the C2 server ] C. Chrome Browser Password Stealer Module This module steals information from the Chrome Browser and sees the value of the cookie and login data file in the ¡ ° \AppData\Local\Google\Chrome\User "
"ESET_Attor","hasproduct","Opera","ORG","Internet Explorer","PRODUCT","Targeted are mostly web browsers , including all major ( Firefox , Opera , Chrome , Safari , Internet Explorer ) and a few less popular ( Maxthon , Avant , SeaMonkey ) ones . "
"Dropping Anchor_ From a TrickBot Infection to the Discovery of the Anchor Malware","hasproduct","Microsoft","ORG","Word","PRODUCT","The campaigns use a TrickBot downloader that is signed and uses an icon to pretend it is a Microsoft Word document . "
"huge-fan-of-your-work-intelligence-report","hasattacklocation","Anthem","ORG","China","GPE","Further reporting tied a breach at United Airlines to the same group that perpetrated Anthem and OPM , reaffirming that those actors had interests in aviation as well.33 It is likely that the DoJ indictments provided yet another piece to this complicated puzzle that saw the pilfering of the data of millions of cleared U.S. government workers funneled to China , a veritable intelligence gold - mine for recruiting potential future spies . "
"APT40 Examining a China-Nexus Espionage Actor  APT40 Examining a China-Nexus Espionage Actor","hasproduct","Sysinternals","ORG","ProcDump","PRODUCT","Additionally , the Windows Sysinternals ProcDump utility and Windows Credential Editor ( WCE ) are believed to be used during intrusions as well . "
"Chrome 0-day exploit CVE-2019-13720 used in Operation WizardOpium ","hasproduct","Google","ORG","Chrome","PRODUCT","Recently , it caught a new unknown exploit for Google¡¯s Chrome browser . "
"GALLIUM_ Targeting global telecom","hasattacklocation","MSTIC","ORG","China","GPE","MSTIC analysis indicates the use of dynamic DNS providers as opposed to registered domains is in line with GALLIUM¡¯s trend towards low cost and low effort operations . GALLIUM domains have been observed hosted on infrastructure in mainland China , Hong Kong SAR , and Taiwan . "
"FIN7.5_ the infamous cybercrime rig “FIN7” continues its activities","hasproduct","Microsoft","ORG","Word","PRODUCT","The .rst one exploits the INCLUDEPICTURE feature of Microsoft Word to get context information about the victim¡¯s computer , and the availability and version number of Microsoft Word . "
"GALLIUM_ Targeting global telecom","hasproduct","Microsoft","ORG","GitHub","PRODUCT","Microsoft GitHub . "
"Operation Spy Cloud_eng","hasattacklocation","Dropbox","ORG","South Korea","GPE","Also , cloud services such as Dropbox and pCloud have been used as command control ( C2 ) servers for information leaks . https://t1.daumcdn.net/cfile/tistory/9943853C5E6EDAF334 [ Figure 15 ] Comparison of final binary functions installed as a hwp document file As we have seen so far , the ' Geumseong 121 ' group has been continuously carrying out the multiple threat activities targeting against South Korea . "
"GALLIUM_ Targeting global telecom","hasproduct","Microsoft","ORG","Authenticator","PRODUCT","Note : Microsoft strongly encourages all customers download and use passwordless solutions like the Microsoft Authenticator app or Windows Hello to secure your accounts . "
"ESET_Attor","hasproduct","Chrome","ORG","Internet Explorer","PRODUCT","Targeted are mostly web browsers , including all major ( Firefox , Opera , Chrome , Safari , Internet Explorer ) and a few less popular ( Maxthon , Avant , SeaMonkey ) ones . "
"APT40 Examining a China-Nexus Espionage Actor  APT40 Examining a China-Nexus Espionage Actor","hasattacklocation","APT40","ORG","China","GPE","We assess with moderate confidence that APT40 is a state - sponsored Chinese cyber espionage operation . The actor¡¯s targeting is consistent with Chinese state interests and there are multiple technical artifacts indicating the actor is based in China . "
"ESET-LightNeuron","hasattacklocation","Turla","ORG","Brazil","GPE","Targeting These targets are in line with traditional Turla targets . Figure 3 shows the geographical location of the identified targets . The Eastern European and Middle East targets are diplomatic organizations . Regarding the Brazilian target , the sample was uploaded to VirusTotal . Thus , we can not know the exact nature of the victim or even be sure that the victim was based in Brazil . "
"CyberInt_Legit Remote Access Tools Turn Into Threat Actors' Tools_Report","hasproduct","Microsoft","ORG","Windows","PRODUCT","In addition to the availability of commercial licences , the tool is free for non - commercial use and supports the remote administration of both Microsoft Windows and Android devices . "
"China Chopper still active 9 years later","hasproduct","Oracle","ORG","WebLogic","PRODUCT","We do not have additional data about how the web shell was installed , but there are several web application frameworks such as older versions of Oracle WebLogic or WordPress that may have been targeted with known remote code execution or .le inclusion exploits . "
"Malware Used by Rocke Group Evolves to Evade Detection by Cloud Security Products","hasproduct","Oracle","ORG","WebLogic","PRODUCT","For example , by exploiting Oracle WebLogic vulnerability CVE-2017 - 10271 in Linux shown in Figure 1 , a compromised Linux victim machine downloads backdoor 0720.bin and opens a shell . "
"Buhtrap group uses zero‑day in latest espionage campaigns","hasproduct","Microsoft","ORG","Windows","PRODUCT","The exploit abuses a local privilege escalation vulnerability in Microsoft Windows , speci.cally a NULL pointer dereference in the win32k.sys component . "
"APT10 Targeted Norwegian MSP and US Companies in Sustained Campaign","hasattacklocation","Citrix","ORG","China","GPE","While we are confident that APT10 actors gained access to the Visma network in August using stolen employee Citrix remote desktop credentials , it is not clear how or when these credentials were initially compromised . Throughout August 2018 , the APT10 actors regularly logged in to the Visma network via accessible Citrix servers using two valid user accounts . The times of the logins were consistent with a GMT+8 timezone , indicative of typical Tianjin , China working hours . "
"Iranian-Nation-State-APT-Leak-Analysis-and-Overview","hasattacklocation","Windows Mobile","ORG","Australia","GPE","Windows Mobile . Targeted entities The main targets of the group are . Governmental departments , agencies and offices . . Airlines . . Telecom companies . . IT companies . Targeted countries Asia Africa Other Sri Lanka Oman Egypt Fiji India Israel Morocco New Zealand UAE Turkey Ethiopia Australia Dubai Iraq Kenia "
"China Chopper still active 9 years later","hasproduct","Internet Information Services","ORG","Apache","PRODUCT","In our research , we discovered both Internet Information Services ( IIS ) and Apache web servers compromised with China Chopper web shells . "
"Newly identified StrongPity operations _ AT&T Alien Labs","indicates","3PM UTC","TIME","the compilation hours","TIME","A potential insight into the adversary can be gained from reviewing the compilation hours of the large collection of malware samples . Based on this report¡¯s findings , all samples fit into a standard eight hour workday between 7AM UTC and 3PM UTC . "
"Insights from one year of tracking a polymorphic threat","hasproduct","AVG","ORG","Windows Defender Antivirus","PRODUCT","When we .rst began our research , the batch script only checked for antivirus products from Avast and AVG . Later , Windows Defender Antivirus was added to the checklist . "
"PKPLUG_ Chinese Cyber Espionage Group Attacking Asia","hasproduct","Microsoft","ORG","Word","PRODUCT","The content of the website contained encoded VBScript that executed PowerShell commands to download a Microsoft Word document from the same GeoCities site , as well as another encoded PowerShell script closely resembling PowerSploit ¡ ª a PowerShell post - exploitation framework for pentesters that¡¯s available on GitHub ¡ ª that was responsible for decoding and launching a Poison Ivy payload . "
"Dropping Anchor_ From a TrickBot Infection to the Discovery of the Anchor Malware","hasproduct","Microsoft","ORG","Word","PRODUCT","To avoid suspicion , the decoy message suggests the user should update Microsoft Word or open the file from another computer . "
"cta-2019-0206","hasproduct","Dropbox","ORG","API","PRODUCT","They also used WinRAR and cURL for Windows , both often renamed , to compress and upload the exfiltrated files from the Visma network to the Dropbox API . "
"Insights from one year of tracking a polymorphic threat","hasproduct","Avast","ORG","Windows Defender Antivirus","PRODUCT","When we .rst began our research , the batch script only checked for antivirus products from Avast and AVG . Later , Windows Defender Antivirus was added to the checklist . "
"OceanLotus_KerrDown","hasproduct","Microsoft","ORG","Word","PRODUCT","The Microsoft Word exe loads wwlib.dll in the same directory and executes ¡ ® FMain¡¯ function of the DLL . 2 . "
"cta-2019-0206","hasproduct","Mimikatz","ORG","Windows","PRODUCT","Extensive use of command - line tools including , but not limited to , Mimikatz , cURL for Windows , BITSAdmin , and WinRAR , to perform actions on - host . "
"Chrome 0-day exploit CVE-2019-13720 used in Operation WizardOpium ","hasproduct","Google","ORG","Chrome","PRODUCT","The vulnerability tries to exploit the bug in Google Chrome browser and the script checks if the version is greater or equal to 65 ( current Chrome version is 78 ): "
"Buckeye_ Espionage Outfit Used Equation Group Tools Prior to Shadow Brokers Leak","indicates","CVE-2019-0703","PRODUCT","two","CARDINAL","Bemstour exploits two Windows vulnerabilities in order to achieve remote kernel code execution on targeted computers . One vulnerability is a Windows zero - day vulnerability ( CVE-2019 - 0703 ) discovered by Symantec . "
"Emissary Panda Attacks Middle East Government Sharepoint Servers","hasproduct","CVE-2019-0604","ORG","SharePoint","PRODUCT","Both of these alerts discussed campaigns in which actors used the CVE-2019 - 0604 to exploit SharePoint servers to install the China Chopper webshell . "
"CERTFR-2019-CTI-005","hasproduct","VMWARE","ORG","MAC","PRODUCT","If this information is logged and depending on the usages of VMWARE inside a company , incoming connections with VMWARE MAC addresses may be linked to an attack . "
"OceanLotus_KerrDown","hasproduct","KerrDown","ORG","DLLs","PRODUCT","As discussed in the delivery document analysis above , depending on the OS architecture either of the embedded KerrDown DLLs will be dropped in the victim machine . "
"ESET_Attor","hasattacktime","Blowfish","ORG","30 years","DATE","Attor encrypts data with a combination of Blowfish and RSA ciphers before Exfiltration T1022 Data Encrypted sending it to the C&C server . Exfiltration Over Command and T1041 Attor exfiltrates data over the C&C channel . Control Channel ABOUT ESET For 30 years , ESET . has been developing industry - leading IT security software and services for businesses and consumers worldwide With solutions ranging from endpoint and mobile security , to encryption and two - factor authentication , ESET¡¯s high - performing , easy - to - use products give consumers and businesses the peace of mind to enjoy the full potential of their technology . "
"huge-fan-of-your-work-intelligence-report","hasproduct","Boeing","ORG","787.36","PRODUCT","In May 2017 , weeks after the C919¡¯s successful maiden flight in China , AECC and Russia¡¯s United Aircraft Corp ( UAC ) announced a 50 - 50 joint venture ( JV ) called China - Russia Commercial Aircraft International Corp ( CRAIC ) to fund and design a new aircraft dubbed CR929 ( see Figure 10 ) , a wide - body jet designed to compete with the Airbus 350 and Boeing 787.36 "
"ESET_Attor","hasattacklocation","Screengrabber","ORG","Russia","GPE","The strings from the list of services targeted by the Screengrabber , that support this claim , are documented in Table 6 . Table 6 // Artifacts from Attor¡¯s Screengrabber associated with Russian applications Process name / window title substring Context § ° § ¥ § ¯§ ° §¬§­§¡§³§³§¯§ª§¬§ª ( transl . Classmates ) Russian social network ( Odnoklassniki ) AGENTVKONTAKTE Russian social network ( VKontakte ) WEBMONEY Online payment system used in Russia ( WebMoney ) "
"cta-2019-0206","hasproduct","Microsoft","ORG","BITSAdmin","PRODUCT","The attackers used Mimikatz ( pd.exe ) to enable credential theft and made use of scheduled tasks via the Microsoft BITSAdmin utility to transfer files from their C2 to the Visma network . "
"Operation_Pistacchietto","hasproduct","Microsoft","ORG","Windows","PRODUCT","Behind the lack of professional infrastructure , the ¡ ° hiding in plain sight¡± strategy , the developer¡¯s comments , the drafted malware code analyzed and the speculations about the possible amateur nature of this actor , we are in front of a long running espionage operation , active from years , and supporting at least four of the main computing platforms available nowadays , being able to infect Microsoft Windows hosts , Mac OSX systems , Linux servers and Android mobile devices . "
"Rancor_ Cyber Espionage Group Uses New Custom Malware to Attack Southeast Asia","hasproduct","Microsoft","ORG","Excel","PRODUCT","The DUDELL sample is a weaponized Microsoft Excel document that contains a malicious macro that runs on the victim¡¯s machine . "
"cta-2019-0206","hasproduct","Visma","ORG","Windows","PRODUCT","They also used WinRAR and cURL for Windows , both often renamed , to compress and upload the exfiltrated files from the Visma network to the Dropbox API . "
"DNS Hijacking Abuses Trust In Core Internet Service","hasattacklocation","Packet Clearing House","ORG","North Africa","GPE","Update 4/18 : A correction has been made to our research based on feedback from Packet Clearing House , we thank them for their assistance Preface This blog post discusses the technical details of a state - sponsored attack manipulating DNS systems . While this incident is limited to targeting primarily national security organizations in the Middle East and North Africa , and we do not want to overstate the consequences of this speci.c campaign , we are concerned that the success of this operation will lead to actors more broadly attacking the global DNS system . "
"Operation Tripoli ","hasattacklocation","Haftar","PERSON","Libya","GPE","Funnily enough , one of the pages whose name is ¡ ° We All Stand with Major General Khalifa Haftar¡± shared a post calling Haftar a criminal : In general , the content has a national agenda that above all cares for the greater good of Libya and warns against external or internal threats . "
"Latest Spam Campaigns from TA505 Now Using New Malware Tools Gelup and FlowerPippi","hasattacklocation","FlawedAmmyy","ORG","India","GPE","The tool also usesthe packer of FlawedAmmyy , a remote access trojan , from previous campaigns . TA505 is also usingFlowerPippi ( Backdoor . Win32.FLOWERPIPPI.A ) , a new backdoor that we found them using in theircampaigns against targets in Japan , India , and Argentina . "
"APT10 Targeted Norwegian MSP and US Companies in Sustained Campaign","hasproduct","Dropbox","ORG","API","PRODUCT","They also used WinRAR and cURL for Windows , both often renamed , to compress and upload the exfiltrated files from the Visma network to the Dropbox API . "
"Operation_Comando","targets","¡°Operation Comando¡±","ORG","Remote Access Trojans","PRODUCT","The continuous use of the ¡ ° CDT¡± acronym , and the presence of the word ¡ ° Comando¡± , which we could associate to the first letter , led to us to choose ¡ ° Operation Comando¡± to describe this campaign . Extensive use of Remote Access Trojans "
"ESET_Operation_Ghost_Dukes","hasproduct","RegDuke","ORG","Dropbox","PRODUCT","For RegDuke , they also use Dropbox as a C&C server . "
"cta-2019-0206","indicates","UPPERCUT","PRODUCT","three","CARDINAL","In addition to using Trochilus and UPPERCUT , APT10 utilized a series of previously known and associated attack TTPs for all three of these intrusions . "
"Latest Spam Campaigns from TA505 Now Using New Malware Tools Gelup and FlowerPippi","hasattacklocation","TA505","ORG","South Korea","GPE","Since our last research on TA505 , we have observed new activity from the group that involves campaignstargeting different countries over the last few weeks . We found them targeting countries in the Middle Eastsuch as United Arab Emirates and Saudi Arabia , as well as other countries such as India , Japan , Argentina , the Philippines , and South Korea . "
"ESET-LightNeuron","hasproduct","Transport Agent","ORG","Windows","PRODUCT","Identification The malicious Transport Agent is a 32 - bit Windows DLL developed in .NET . "
"PKPLUG_ Chinese Cyber Espionage Group Attacking Asia","hasattacklocation","PKPLUG","ORG","Myanmar","GPE","Unit 42 incorporates these .ndings , together with our own , under the moniker PKPLUG and continue to track accordingly . It¡¯s not entirely clear as to the ultimate objectives of PKPLUG , but installing backdoor Trojan implants on victim systems , including mobile devices , infers tracking victims and gathering information is a key goal . We believe victims lay mainly in and around the Southeast Asia region , particularly Myanmar , Taiwan , Vietnam , and Indonesia ; and likely also in various other areas in Asia , such as Tibet , Xinjiang , and Mongolia . "
"Operation_Kitty_Phishing","hasproduct","the Chrome Browser","ORG","C2","PRODUCT","[ Code to store the victim¡¯s keyboard input value ] [ Keylogging information sent to the C2 server ] C. Chrome Browser Password Stealer Module This module steals information from the Chrome Browser and sees the value of the cookie and login data file in the ¡ ° \AppData\Local\Google\Chrome\User "
"Operation Spy Cloud_eng","hasattacklocation","APT","ORG","South Korea","GPE","The Background of ' Operation Spy Cloud ' APT Campaign ESRC ( ESTsecurity Security Response Center ) researchers identified the new APT campaign carried out by the state - sponsored group named ' Geumseong121 ' in early March 2020 . ' Geumseong121 ' , a North Korean threat group has been conducting the state - sponsored espionage activities in the cyberspace of South Korea for years , mainly targeting those who are engaged in unification , foreign affairs , or national security , the leaders of the organizations specializing in North Korean issues , and North Korean refugees . "
"cta-2019-0626","hasattacklocation","BistBots","ORG","Iran","GPE","We assess that this likely indicates a desire to target users of BistBots who seek up - to - date , high - speed internet proxies , possibly to circumvent network filtering and access sites such as Facebook , Twitter , and YouTube , which are restricted in Iran . "
"APT40 Examining a China-Nexus Espionage Actor  APT40 Examining a China-Nexus Espionage Actor","hasproduct","APT40","ORG","Windows","PRODUCT","APT40 frequently uses native Windows commands , such as net.exe , to conduct internal reconnaissance of a victim¡¯s environment . "
"GALLIUM_ Targeting global telecom","hasproduct","Microsoft","ORG","Azure Sentinel","PRODUCT","Microsoft GitHub . Figure 2 . Azure Sentinel query of GALLIUM indicators . "
"Chinese APT Hackers Attack Windows Users via FakeNarrator Malware","hasproduct","Microsoft","ORG","Windows","PRODUCT","Threat actors loaded this open - source software in victims machine with the help of legitimate NVIDIA application and also deploy the FakeNarrator screen reader application to replace the Windows built - in Narrator , a free screen reader in Microsoft Windows nad bypass the Windows ¡ ° Easy access¡± feature . "
"CyberInt_Legit Remote Access Tools Turn Into Threat Actors' Tools_Report","hasproduct","Microsoft","ORG","Windows Installer","PRODUCT","Unlike the US - based retail campaign , the spreadsheet lure does not contain VBA macros and instead spawns a Microsoft Windows Installer process ( Figure 18 ) to download an additional payload from the threat actor¡¯s command and control ( C2 ) infrastructure . "
"Latest Spam Campaigns from TA505 Now Using New Malware Tools Gelup and FlowerPippi","hasattacklocation","Loseway Lu","PERSON","Argentina,the Philippines","GPE","By : Hara Hiroaki and Loseway Lu ( Threats Analysts ) Since our last research on TA505 , we have observed new activity from the group that involves campaignstargeting different countries over the last few weeks . We found them targeting countries in the Middle Eastsuch as United Arab Emirates and Saudi Arabia , as well as other countries such as India , Japan , Argentina , the Philippines , and South Korea . "
"Iranian-Nation-State-APT-Leak-Analysis-and-Overview","hasproduct","Microsoft","ORG","Office365","PRODUCT","The use of a local Microsoft Office365 email server . "
"Bitter_APT_Malware_analysis","hasattacklocation","Bitter","ORG","Bulgaria","GPE","This process graph represents the cyber kill chain of Bitter sample . Cyber Threat Intel Since the last 2 weeks , the C2 domain have changed ( .193 to .198 ) due to this are on the same subnet of the Verdina organization ( Bulgaria cloud provider ) . "
"Latest Spam Campaigns from TA505 Now Using New Malware Tools Gelup and FlowerPippi","hasattacklocation","TA505","ORG","Argentina,the Philippines","GPE","Since our last research on TA505 , we have observed new activity from the group that involves campaignstargeting different countries over the last few weeks . We found them targeting countries in the Middle Eastsuch as United Arab Emirates and Saudi Arabia , as well as other countries such as India , Japan , Argentina , the Philippines , and South Korea . "
"PKPLUG_ Chinese Cyber Espionage Group Attacking Asia","hasattacklocation","PKPLUG","ORG","Taiwan","GPE","Unit 42 incorporates these .ndings , together with our own , under the moniker PKPLUG and continue to track accordingly . It¡¯s not entirely clear as to the ultimate objectives of PKPLUG , but installing backdoor Trojan implants on victim systems , including mobile devices , infers tracking victims and gathering information is a key goal . We believe victims lay mainly in and around the Southeast Asia region , particularly Myanmar , Taiwan , Vietnam , and Indonesia ; and likely also in various other areas in Asia , such as Tibet , Xinjiang , and Mongolia . "
"Operation_Sheep","hasproduct","Batmobi","ORG","Cheetah SDK","PRODUCT","According to Cheetah Mobile¡¯s follow - up investigation , rd fraudulent behaviors came from two 3 party SDKs ( Batmobi , Duapps ) integrated inside Cheetah SDK . "
"ESET_Operation_Ghost_Dukes","hasattacktime","Operation Ghost","WORK_OF_ART","September July September","DATE","Figure 4 // Reddit post containing an encoded C&C URL Figure 5 presents the timeline of Operation Ghost . As it is based on ESET telemetry , it might be only a partial view of a broader campaign . .¡ã .. .¡ã . ¡ ¦ .¡ã.6 September July September "
