"FileName","RelationType","Entity1Mention","Entity1Type","Entity2Mention","Entity2Type","Context"
"China-Based APT Mustang Panda Targets Minority Groups, Public and Private Sector Organizations","hasattacklocation","Belt and Road Initiative","ORG","China","GPE","This kind of malicious activity sponsored by China will likely continue as the country expands its efforts for the ongoing Belt and Road Initiative that seeks to invest in infrastructure in over 100 countries . Such economic and investment - led initiatives will cause China to be more interested in the regions its investing in , therefore it is likely that APT - related activity will follow . "
"huge-fan-of-your-work-intelligence-report","hasattacklocation","ZHUANG Xiaowei","PERSON","China","GPE","Reporting to CHAI was the cyber operator team lead , LIU Chunliang ( Áõ´ºÁÁ /sxpdlc1r / Fangshou ) , who appeared to establish and maintain much of the infrastructure used in the attacks on various aerospace targets as well as organize the intrusions conducted by the operators ZHANG Zhanggui ( ÕÅ³¤¹ó /Ieanovr / Ieaonr ) , GAO Hongkun ( ¸ßºéÀ¤/Mer4en7y ) , ZHUANG Xiaowei ( ×¯èÉÎ ° /jpxxav ) , MA Zhiqi ( ÂíÖ¾ç÷ /Le Ma ) , and LI Xiao ( Àîäì / zhuan86 ) . Many of these individuals are assessed to have storied histories in legacy underground hacking circles within China dating back to at least 2004 . "
"ESET_Okrum_and_Ketrican","hasattacklocation","Ke3chang","ORG","Chile","GPE","Second , we identified a previously undocumented malware family with strong links to the Ke3chang group . a backdoor we named Okrum . We first detected Okrum , through ESET telemetry , in December 2016 ; it targeted diplomatic missions in Slovakia , Belgium , Chile , Guatemala and Brazil throughout 2017 . "
"CyberInt_Legit Remote Access Tools Turn Into Threat Actors' Tools_Report","indicates","the ¡®Relay Server¡¯","PRODUCT","three","CARDINAL","This RU Server supports three roles that can be deployed individually or together , although only one , the ¡ ® Relay Server¡¯ , would likely be utilised in nefarious implementations . "
"Partners in crime_ North Koreans and elite Russian-speaking cybercriminals - Intel 471","hasproduct","TA505","ORG","Emotet","PRODUCT","Equating all Emotet or TrickBot activity to TA505 . TA505 never used Emotet andonly used TrickBot for a short period of time in late 2017 . "
"Partners in crime_ North Koreans and elite Russian-speaking cybercriminals - Intel 471","hasmember","Wired","WORK_OF_ART","two","CARDINAL","This blog post quotes a 2019 BAE Systemspresentation from Kaspersky¡¯s annual security researcher conference ( SAS ) that mentionsa ¡ ° possible overlap between TA505 intrusions and DPRK intrusions , suggesting a possiblehand - off between the two groups.¡± Norfolk¡¯s post included a link to an article from Wired that was posted on April 9 , 2019,and titled ¡ ° A New Breed of ATM Hackers Gets in Through a Bank¡¯s Network.¡± Within theWired article are quotes from BAE Systems Intelligence Analyst Saher Naumaan ( one ofthe presenters of the presentation at SAS ) with regard to links between Lazarus andTA505 : In their incident response work with banks , BAE Systems analysts repeatedly noticedthat the victim networks they were studying were infected with both a malware dubbedGraceWire and known Lazarus malware tools . "
"APT40 Examining a China-Nexus Espionage Actor  APT40 Examining a China-Nexus Espionage Actor","hasattacklocation","¡°Belt and Road Initiative¡±","ORG","the United States","GPE","China¡¯s ¡ ° One Belt , One Road¡± ( Ò»´øÒ»Â · ) or ¡ ° Belt and Road Initiative¡± ( BRI ) is a $ 1 trillion USD endeavor to build land and maritime trade routes across Asia , Europe , the Middle East , and Africa to develop a trade network that will project China¡¯s influence across the greater region . Figure 1 : Countries and industries targeted . Countries include the United States , United Kingdom , Norway , Germany , Saudi Arabia , Cambodia and Indonesia "
"ESET_Okrum_and_Ketrican","targets","FireEye","ORG","BS2005","PRODUCT","According to the FireEye report , at least one of the BS2005 samples from operation Ke3chang contained the very same heuristic . "
"APT40 Examining a China-Nexus Espionage Actor  APT40 Examining a China-Nexus Espionage Actor","hasattacklocation","APT40","ORG","China","GPE","In one instance , a log file recovered from an open indexed server revealed that an IP address ( 112.66.188.28 ) located in Hainan , China had been used to administer the command and control node that was communicating with malware on victim machines . All of the logins to this C2 were from computers configured with Chinese language settings . Attack Lifecycle Initial Compromise APT40 has been observed leveraging a variety of techniques for initial compromise , including web server exploitation , phishing campaigns delivering publicly available and custom backdoors , and strategic web compromises . "
"FIN7.5_ the infamous cybercrime rig “FIN7” continues its activities","hasattacklocation","CobaltStrike","ORG","Europe","LOC","At the end of 2018 , the cluster started to use not only CobaltStrike but also Powershell Empire in order to gain a foothold on the victims¡¯ networks . After a successful penetration , it uses its own backdoors and the CobaltStrike framework or Powershell Empire components to hop to interesting parts of the network , where it can monetize its access . FIN7¡¯s last campaigns were targeting banks in Europe and Central America . "
"ESET_Okrum_and_Ketrican","hasproduct","2015","DATE","Ketrican","PRODUCT","A trick to detect an emulated environment or a sandbox Figure 9 // Specific format of data received from the C&C server in samples from operation Ke3chang ( left ) and 2015 Ketrican samples Figure 10 // Encryption algorithm used in a BS2005 sample and in a Ketrican backdoor discovered in 2015 Table 5 // IoCs extracted from the analyzed Ketrican samples discovered by ESET in 2017 "
"apt-c-36-continuous-attacks-targeting-colombian-government-institutions-and-corporations-en","indicates","13:49","TIME","8 hours","TIME","Take password protected RAR archive ( Registraduria Nacional del Estado Civil -Proceso inicado.rar ) as an example , the time after decryption is the same as the left one located in the MHTML meta data ( the last modi.ed time on the right side needs to be reduced by 8 hours since we are in the UTC +8 time zone ) . By comparing each last modi.ed time of the RAR archive with the one located in the meta data , we have con.dence to say that the time is not spoofed . So it makes sense to perform related statistics of all the bait documents captured . Statistics of the Last Modi.ed Time All of the last modi.ed time from the captured bait documents are shown in the table below : UTC+00 00:32 01:15 01:15 01:17 01:35 01:59 02:57 2/19/2019 360ÍþÐ²Çé±¨ÖÐÐÄ 03:28 04:40 04:55 05:17 12:27 12:49 12:50 13:38 13:42 13:49 14:21 14:22 15:19 15:26 15:30 15:56 17:22 17:58 18:31 20:53 21:31 23:30 From the above we could see that the time never distributed between 05:30 and 12:30 , which supposed to be sleep hours . Combining with the fact that most of the activities are between 13:00 and 2:00 , we suspect attackers are in the UTC -4 time zone ( or adjacent ones ) . PE Timestamp We also performed statistics of timestamps in the dumped PE samples and .gure out they are not far from the one in the bait documents : Last Modi.ed Time of Bait Document Timestamp in PE Dump 2019/2/11 17:58 2019/2/14 3:28 2018/12/3 15:30 2018/12/3 23:26 2018/11/26 18:31 2018/10/17 22:29 2018/11/15 12:49 2018/10/17 22:29 2/19/2019 360ÍþÐ²Çé±¨ÖÐÐÄ 2018/11/8 14:21 2018/10/17 22:29 2018/10/26 13:49 2018/10/17 22:29 2018/10/22 17:22 2018/10/17 22:29 2018/10/12 15:56 2018/10/17 22:29 2018/10/4 5:17 2018/9/13 13:42 "
"Elfin Relentless Espionage Group Targets Multiple Organizations in Saudi Arabia and US","hasattacklocation","one","CARDINAL","Saudi Arabia","GPE","The exploit was used against one target in the chemical sector in Saudi Arabia . "
"GALLIUM_ Targeting global telecom","targets","Microsoft","ORG","BlackMould","PRODUCT","In addition to standard China Chopper , GALLIUM has been observed using a native web shell for servers running Microsoft IIS that is based on the China Chopper web shell ; Microsoft has called this ¡ ° BlackMould.¡± BlackMould contains functionality to perform the following tasks on a victim host : Enumerate local drives . "
"APT10 Targeted Norwegian MSP and US Companies in Sustained Campaign","hasattacklocation","Visma","ORG","Tianjin","GPE","We believe that the APT10 targeting of Visma is an extension of their 2017 Cloud Hopper operation ( which victimized some of the world¡¯s largest MSPs ) and has continued into late 2018 . 6 . The unauthorized access to Citrix remote desktop clients at Visma using stolen credentials occured at times corresponding to Tianjin working hours ( GMT +8 ) . "
"ESET discovers Attor, a spy platform with curious GSM fingerprinting _ WeLiveSecurity","hasproduct","Attor","ORG","TrueCrypt","PRODUCT","Attor is con.gured to capture screenshots of encryption / digital signature utilities , the VPN service HMA , end.to.end encryption email services Hushmail and The Bat ! , and the disk encryption utility TrueCrypt . The victim¡¯s usage of TrueCrypt is further inspected in another part of Attor . "
"New_Destructive_Wiper_ZeroCleare_Final_","targets","ZeroCleare","ORG","Windows","PRODUCT","The general flow of events on 64 - bit machines includes using a vulnerable , signed driver and then exploiting it on the target device to allow ZeroCleare to bypass the Windows hardware abstraction layer and avoid some operating system safeguards that prevent unsigned drivers from running on 64 - bit machines . "
"Recent Cloud Atlas activity _ Securelist","targets","VBShower","ORG","Cloud Atlas","PRODUCT","At the time of writing , two VBS .les have been seen pushed to the target computer by VBShower . The .rst one is an installer for PowerShower and the second one is an installer for the Cloud Atlas second stage modular backdoor which communicates to a cloud storage service via Webdav . "
"Operation_Sheep","hasproduct","Tencent MyApp","ORG","Android","PRODUCT","The Attack Vector The SDK , named SWAnalytics , is integrated into seemingly innocent Android applicationsrd published on major 3 party Chinese app stores such as Tencent MyApp , Wandoujia , Huawei App Store , and Xiaomi App Store . "
"OceanLotus Attacks to Indochinese Peninsula","hasattacklocation","SkyEye Team","ORG","China","GPE","The group was .rst revealed and named by SkyEye Team in May 2015 . Its attack activities can be traced back to April 2012 . The targets include China 's maritime institutions , maritime construction , scienti.c research institutes and shipping enterprises . "
"ESET_Attor","hasproduct","WinRAR","ORG","Excel","PRODUCT","Email services ( Gmail , AOL Mail , Hotmail , Hotbox , Webmail , Yahoo ! Mail ) . Office software ( MS Word , Powerpoint , Excel , Visio , Notepad , Notepad++ , Wordpad ) . Archiving utilities ( WinRAR , WinZip , Hamster ) . "
"Palmerworm_ Espionage Gang Targets the Media, Finance, and Other Sectors _ Symantec Blogs","hasattacklocation","Symantec","ORG","China","GPE","The Threat Hunter Team at Symantec , a division of Broadcom ( NASDAQ:.AVGO ) , hasuncovered a new espionage campaign carried out by the Palmerworm group ( akaBlackTech ) involving a brand new suite of custom malware , targeting organizations inJapan , Taiwan , the U.S. , and China . "
"huge-fan-of-your-work-intelligence-report","hasattacklocation","YU Pingan","PERSON","Beijing","GPE","The arrests of MSS officer XU Yanjun , his insiders ( ZHENG Xiaoqing and JI Chaoqun ) , and Sakula developer YU Pingan will ultimately not deter Beijing from mounting other significant cyber campaigns designed to achieve leapfrog development in areas they perceive to be of strategic importance . "
"ESET_Attor","hasproduct","Wordpad)   .  Archiving","ORG","Excel","PRODUCT","Email services ( Gmail , AOL Mail , Hotmail , Hotbox , Webmail , Yahoo ! Mail ) . Office software ( MS Word , Powerpoint , Excel , Visio , Notepad , Notepad++ , Wordpad ) . Archiving utilities ( WinRAR , WinZip , Hamster ) . "
"APT10 Targeted Norwegian MSP and US Companies in Sustained Campaign","hasattacklocation","Guangdong  ITSEC","ORG","Brazil","GPE","Our research from 2017 concluded that Guangdong ITSEC ( and therefore the MSS ) directed the activities of a company named Boyusec , which was identified as a shell company for APT3 . Suspected Tianjin State Security Bureau headquarters . ( Source : IntrusionTruth ) The December APT10 indictment noted that the group¡¯s malicious activities breached at least 45 companies and managed service providers in 12 countries , including Brazil , Canada , Finland , France , Germany , India , Japan , Sweden , Switzerland , the United Arab Emirates , the United Kingdom , and the United States . "
"APT10 Targeted Norwegian MSP and US Companies in Sustained Campaign","hasattacklocation","IntrusionTruth","ORG","Switzerland","GPE","( Source : IntrusionTruth ) The December APT10 indictment noted that the group¡¯s malicious activities breached at least 45 companies and managed service providers in 12 countries , including Brazil , Canada , Finland , France , Germany , India , Japan , Sweden , Switzerland , the United Arab Emirates , the United Kingdom , and the United States . "
"ESET_Operation_Ghost_Dukes","indicates","19] and Sednit","WORK_OF_ART","20","CARDINAL","Turla [ 19 ] and Sednit [ 20 ] . "
"ESET_Operation_Ghost_Dukes","targets","PolyglotDuke","ORG","MiniDuke","PRODUCT","Figure 6 // Comparison of a custom string encryption function found in PolyglotDuke and in OnionDuke samples from 2013 Similarly , the recent samples of the MiniDuke backdoor bear similarities with samples documented more than five years ago . "
"China-Based APT Mustang Panda Targets Minority Groups, Public and Private Sector Organizations","hasattacklocation","Kathy Wilheml","PERSON","China","GPE","[ 5 ] Kathy Wilheml , ¡ ° China , Vietnam Make Money , Not War ; Border Tensions Remain : Asia : Many fear the dispute over Friendship Pass and more than 200 other sites could reignite .ghting between the longtime enemies,¡± Los Angeles Times , accessed September 18 , 2019 , published October 22 , 1995 , https://www.latimes.com/archives/la-xpm-1995-10-22-mn-59742-story.html . "
"cta-2019-0206","hasattacklocation","APT3","ORG","France","GPE","Our research from 2017 concluded that Guangdong ITSEC ( and therefore the MSS ) directed the activities of a company named Boyusec , which was identified as a shell company for APT3 . The December APT10 indictment noted that the group¡¯s malicious activities breached at least 45 companies and managed service providers in 12 countries , including Brazil , Canada , Finland , France , Germany , India , Japan , Sweden , Switzerland , the United Arab Emirates , the United Kingdom , and the United States . "
"Operation_Sheep","hasattacklocation","SWAnalytics","ORG","6","CARDINAL","By the time of this publication , there¡¯s no sign indicating SWAnalytics has penetrated Google Play yet . App name Package name Developer Major publish channels Con.rmed in.fested version IncomingCall Flashlight com.hd .. y .. ashlight HangzhouHui Mao All 6 stores 2.3.1 to 2.3.4 Network SpeedMaster com.syezon.lab.net.workspeed "
"Operation ShadowHammer","hasattacklocation","Kim Zetter","PERSON","Singapore","GPE","Earlier today , Motherboard published a story by Kim Zetter on Operation ShadowHammer , a newly discovered supply chain attack that leveraged ASUS Live Update software . While the investigation is still in progress and full results and technical paper will be published during SAS 2019 conference in Singapore , we would like to share some important details about the attack . "
"APT-C-38_en_google_translate","indicates","SpecialSaber RAT","PRODUCT","two","CARDINAL","By comparing the UnitMM RAT on the Android side with the SpecialSaber RAT on the Windows side , we see that the two adopt a similar approach in the C2 communication link , and the information stolen by the two has a special commonality . "
"PKPLUG_ Chinese Cyber Espionage Group Attacking Asia","hascharacteristics","$2.2  billion","MONEY","1","CARDINAL","Taiwan , which isn¡¯t an AR and doesn¡¯t appear to be actively involved with the BRI , has its own long - standing history with the PRC ¡ ª a recent $ 2.2 billion arms sale with the U.S. may exacerbate matters . Timeline Before continuing , it¡¯s worth highlighting our research and others relating to the intrusion set that we refer to as PKPLUG . This section documents prior work surrounding cyber attacks relating to PKPLUG . The following .gure illustrates the chronological order of the publications ¡ ª highlighting some key .ndings from each . As you can see from the timeline , PKPLUG has been active for six years or more with a variety of targets and methods of delivery and compromise . Figure 1 . "
"huge-fan-of-your-work-intelligence-report","hasproduct","YU¡¯s","ORG","IsSpace","PRODUCT","Notably , LIU also appeared to broker the use of Sakula from its developer YU , as well as the malware IsSpace ( associated with SAMURAI PANDA ) from its likely developer ZHUANG.20 LIU and YU¡¯s conversations about Sakula would be a critical factor in tying all of this disparate activity together as Sakula was believed to be unique to the JSSD operators and could be used to tie several aerospace intrusion operations into a single , long - running campaign . "
"ESET_Operation_Ghost_Dukes","hasattacktime","Dukes","ORG","2014","DATE","However , this is not the only method used by the Dukes to gain initial access . In 2014 , the Dukes started using two mass - spreading methods to deliver the OnionDuke implant : . "
"New_Destructive_Wiper_ZeroCleare_Final_","hasproduct","ClientUpdate.ps1  X-Force IRIS","ORG","PowerShell","PRODUCT","1.81 ClientUpdate.ps1 X - Force IRIS identified two PowerShell scripts with the name ClientUpdate.ps1 . "
"Operation_Sheep","hasattacklocation","Alipay","ORG","China","GPE","In China alone , we have seen underground market ¡ ° sheep shavers¡± ported SMS rogue marketing strategy to spread Alipay Red Packet referral URL links . When receivers click on these referral links , both the sender and receiver receives a small amount of credit in their Alipay accounts . "
"Release the Kraken_ Fileless APT attack abuses Windows Error Reporting service","hasproduct","CactusTorch","ORG","VBA","PRODUCT","Inside , we see a malicious macro that uses a modified version of CactusTorch VBA module to execute its shellcode . "
"DarkHydrus delivers new Trojan that can use Google Drive for C2 communications","indicates","Excel","PRODUCT","three","CARDINAL","These three documents were extremely similar to each other and are all macro enabled Excel documents with .xlsm .le extensions . "
"APT40 Examining a China-Nexus Espionage Actor  APT40 Examining a China-Nexus Espionage Actor","hasattacklocation","Chinese","NORP","China","GPE","The actor¡¯s targeting is consistent with Chinese state interests and there are multiple technical artifacts indicating the actor is based in China . Analysis of the operational times of the group¡¯s activities indicates that it is probably centered around China Standard Time ( UTC +8 ) . In addition , multiple APT40 command and control ( C2 ) domains were initially registered by China based domain resellers and had Whois records with Chinese location information , suggesting a China based infrastructure procurement process . "
"Malware Used by Rocke Group Evolves to Evade Detection by Cloud Security Products","targets","Rocke","ORG","Apache Struts 2","PRODUCT","To deliver the malware to the victim machines , the Rocke group exploits vulnerabilities in Apache Struts 2 , Oracle WebLogic , and Adobe ColdFusion . "
"CyberInt_Legit Remote Access Tools Turn Into Threat Actors' Tools_Report","hascharacteristics","3,000 milliseconds","QUANTITY","3","CARDINAL","The use of the ping command ( lines 2 and 4 ) sends three echo requests to the legitimate domain ¡ ® cloudflare.com¡¯ , with the timeout value set to 3,000 milliseconds , and potentially acts as both a connectivity test and a pause between steps . Assuming the ping process exits without error , indicated by the ¡ ® % ERRORLEVEL%¡¯ not being equal to one , the dropped self - extracting archive file ¡ ® syst . dll¡¯ is first renamed as ¡ ® 7zinstall.exe¡¯ ( line 3 ) and then executed ( line 5 ) . "
"OceanLotus Attacks to Indochinese Peninsula","indicates","OceanLotus","PRODUCT","three","CARDINAL","In the following sections we will examine each of these three macro usage analyses in detail . According to this batch of resume samples , we conducted homologous sample correlation for these three macro documents , combined with various dimensions , and .nally found a large number of exclusive malicious macro samples of OceanLotus . "
"APT10 Targeted Norwegian MSP and US Companies in Sustained Campaign","hasattacklocation","Rapid7","ORG","China","GPE","Our research partner Rapid7 investigated the Dropbox use and found that the attackers had used the same account to store exfiltrated data from a global apparel company . They also identified broadly similar TTPs being used in the attack against a U.S. law firm specializing in intellectual property law . The firm has a dedicated China practice aimed at assisting Chinese companies entering the U.S. market . "
"ESET_Winnti","hasproduct","ShadowHammer","ORG","ShadowPad VMProtected","PRODUCT","the same key used by the PortReuse and ShadowPad VMProtected launcher . These findings add another connection between operation ShadowHammer and compromise campaign in the video - game industry . "
"Latest Spam Campaigns from TA505 Now Using New Malware Tools Gelup and FlowerPippi","hasattacklocation","TA505","ORG","Japan","GPE","In the campaign that targeted Japan , Philippines , and Argentina on June 20 , we found what seems to be anew , undisclosed malware , which we named Gelup . After our analysis , we found that Proofpoint reported thismalware as AndroMut as well . A custom packer was used to pack some variants of this malware ¡ ª the sameone that TA505 had been using . "
"Recent Cloud Atlas activity _ Securelist","indicates","VBS","PRODUCT","every hour","TIME","Once these .les have been deleted and its persistence is achieved in the registry , VBShower sends the context .le computed by the HTA to the remote server and tries to get via HTTP a VBS script to execute from the remote server every hour . At the time of writing , two VBS .les have been seen pushed to the target computer by VBShower . "
"Palmerworm_ Espionage Gang Targets the Media, Finance, and Other Sectors _ Symantec Blogs","hasattacklocation","NASDAQ","ORG","China","GPE","The Threat Hunter Team at Symantec , a division of Broadcom ( NASDAQ:.AVGO ) , hasuncovered a new espionage campaign carried out by the Palmerworm group ( akaBlackTech ) involving a brand new suite of custom malware , targeting organizations inJapan , Taiwan , the U.S. , and China . "
"Palmerworm_ Espionage Gang Targets the Media, Finance, and Other Sectors _ Symantec Blogs","hasattacklocation","AVGO","ORG","China","GPE","The Threat Hunter Team at Symantec , a division of Broadcom ( NASDAQ:.AVGO ) , hasuncovered a new espionage campaign carried out by the Palmerworm group ( akaBlackTech ) involving a brand new suite of custom malware , targeting organizations inJapan , Taiwan , the U.S. , and China . "
"Buckeye_ Espionage Outfit Used Equation Group Tools Prior to Shadow Brokers Leak","hasproduct","Bemstour","ORG","Buckeye","PRODUCT","During this attack , the Bemstour exploit tool was delivered to victims via known Buckeye malware ( Backdoor . Pirpi ) . One hour later , Bemstour was used against an educational institution in Belgium . "
"Elfin Relentless Espionage Group Targets Multiple Organizations in Saudi Arabia and US","hasattacklocation","Elfin","ORG","U.S.","GPE","Elfin also makes frequent use of a number of publicly available hacking tools , including : Case study : How an Elfin attack unfolds In this section , we describe in detail an Elfin attack on a U.S. organization . "
"Rancor_ Cyber Espionage Group Uses New Custom Malware to Attack Southeast Asia","hasproduct","spoolsw.exe","ORG","Regsvr32.exe","PRODUCT","If we recall earlier from the VBScript , spoolsw.exe is the hosts Windows regsvr32.exe . Regsvr32.exe is a Windows tool that registers a module ( DLL ) . "
"Elfin Relentless Espionage Group Targets Multiple Organizations in Saudi Arabia and US","hasproduct","Elfin","ORG","Stonedrill","PRODUCT","One Shamoon victim in Saudi Arabia had recently also been attacked by Elfin and had been infected with the Stonedrill malware ( Trojan . Stonedrill ) used by Elfin . "
