"FileName","RelationType","Entity1Mention","Entity1Type","Entity2Mention","Entity2Type","Context"
"Operation Poisoned News_ Hong Kong Users Targeted With Mobile Malware via Local News Links - TrendLabs Security Intelligence Blog","hasattacklocation","Android","ORG","Hong Kong","GPE","As noted earlier in this blog post , there is an Android counterpart to.lightSpy.which we have called.dmsSpy .. These variants were distributed in publicTelegram channels disguised as various apps in 2019 . While the links were already invalid during our research , we were able to obtain a sample of one of thevariants . Our sample was advertised as a calendar app containing protest schedules in Hong Kong . "
"cta-2019-0206","hasattacklocation","Visma","ORG","China","GPE","They also used WinRAR and cURL for Windows , both often renamed , to compress and upload the exfiltrated files from the Visma network to the Dropbox API . Our research partner Rapid7 investigated the Dropbox use and found that the attackers had used the same account to store exfiltrated data from a global apparel company . They also identified broadly similar TTPs being used in the attack against a U.S. law firm specializing in intellectual property law . The firm has a dedicated China practice aimed at assisting Chinese companies entering the U.S. market . "
"OceanLotus Attacks to Indochinese Peninsula","hasattacklocation","Overview  OceanLotus","ORG","China","GPE","techniques - and - procedure Overview OceanLotus is an APT Group with alleged Vietnamese background . The group was .rst revealed and named by SkyEye Team in May 2015 . Its attack activities can be traced back to April 2012 . The targets include China 's maritime institutions , maritime construction , scienti.c research institutes and shipping enterprises . "
"ESET discovers Attor, a spy platform with curious GSM fingerprinting _ WeLiveSecurity","indicates","Rambler","PRODUCT","two","CARDINAL","Domains misused in the campaign QIP , INFIUM Russian IM application ( QIP ) RAMBLER Russian search engine ( Rambler ) The list includes the two most popular social networks in Russia ( Odnoklassniki , VKontakte ) and a VoIP service provided by a Russian telecom operator ( Multifon ) . "
"ESET_Okrum_and_Ketrican","hasproduct","NetSess","ORG","PsExec","PRODUCT","For example , a Ketrican backdoor from 2017 used NetSess , NetE , ProcDump , PsExec , RAR archiver utility , and Get - PassHashes . 4 KE3CHANG GROUP ACTIVITY IN 2015 - 2019 AND TIES TO OKRUM From 2015 to 2019 , we detected malware that evolved from the BS2005 backdoors from operation Ke3chang . "
"Malware Used by Rocke Group Evolves to Evade Detection by Cloud Security Products","runssoftware","1","CARDINAL","Linux","PRODUCT","For example , by exploiting Oracle WebLogic vulnerability CVE-2017 - 10271 in Linux shown in Figure 1 , a compromised Linux victim machine downloads backdoor 0720.bin and opens a shell . "
"CyberInt_Legit Remote Access Tools Turn Into Threat Actors' Tools_Report","hasattacklocation","RMS","ORG","India","GPE","Attacks against financial institutions in Chile , India , Italy , Malawi , Pakistan and South Korea . Attacks against retailers in the United States Campaign Modus Operandi . Leverage of legitimate software . remote administration tool . to gain entry into networks and evade traditional security controls Delivered via phishing emails containing malicious MS office documents and leveraging social engineering especially with the use of RMS . "
"Defeating Compiler-Level Obfuscations Used in APT10 Malware","hasattacklocation","APT10","ORG","Japan","GPE","ANEL ( also referred to as UpperCut ) is a RAT program used by APT10 and observed in Japan uniquely . "
"China Chopper still active 9 years later","hasattacklocation","China Chopper","ORG","China","GPE","Cisco Talos discovered signi.cant China Chopper activity over a two - year period beginning in June 2017 , which shows that even nine years after its creation , attackers are using China Chopper without signi.cant modi.cations . This web shell is widely available , so almost any threat actor can use . This also means it 's nearly impossible to attribute attacks to a particular group using only presence of China Chopper as an indicator . The usage of China Chopper in recent campaigns proves that a lot of old threats never really die , and defenders on the internet need to be looking out for malware both young and old . "
"Emissary Panda Attacks Middle East Government Sharepoint Servers","hasproduct","The Saudi Arabian National Cyber Security Center¡¯","ORG","SharePoint","PRODUCT","While we can not con.rm all of the claims made in these advisories , we noticed overlaps in the webshell code hosted on the compromised SharePoint servers we observed and the webshells mentioned in these advisories . The Saudi Arabian National Cyber Security Center¡¯s alert provided details regarding the activities carried out by the adversary . "
"Operation Tripoli ","hasattacklocation","Haftar","PERSON","one","CARDINAL","Funnily enough , one of the pages whose name is ¡ ° We All Stand with Major General Khalifa Haftar¡± shared a post calling Haftar a criminal : In general , the content has a national agenda that above all cares for the greater good of Libya and warns against external or internal threats . There were some exceptions to the political themes in the posts , although they still used the victims¡¯ common areas of interest . Back in 2018 , one of the mobile RATs masqueraded as an application that allows its users to watch the FIFA World Cup matches for free . "
"ESET_Okrum_and_Ketrican","hascharacteristics","seven","CARDINAL","1","CARDINAL","At the time of this publication , ESET systems have detected seven different versions of the loader component and two versions of the installer , although the functionality remained the same . We have not been able to find the original attack vector and dropper of the malware , but we have identified several components used in the Okrum malware : . An optional stage 0 loader . Stage 1 loader . "
"DarkHydrus delivers new Trojan that can use Google Drive for C2 communications","hasproduct","Google Drive","ORG","Trojan","PRODUCT","The Trojan processes the downloaded data the same way it would for a unique identi.er as if the data was obtained via the DNS tunneling protocol using the TXT query mode , speci.cally by searching the data using the following regular expression : \¡±(\\w+).(<domainList[0]>|<domainList[1]>|<domainList[n]>).\¡± With the unique identi.er value obtained from the .le on Google Drive , the Trojan will attempt to obtain jobs using the Google Drive communications channel . "
"Registers as “Default Print Monitor”, but is a malicious downloader. Meet DePriMon","indicates","Arabic","LANGUAGE","dozens","CARDINAL","DePriMon was detected in a private company , based in Central Europe , and at dozens of computers in the Middle East . Some of the domain names used as C&C servers contain Arabic words , which gives an indication of a region.speci.c campaign . "
"Operation Soft Cell_ A Worldwide Campaign Against Telecommunications Providers","hasattacklocation","PIVY","ORG","Hong Kong","GPE","Post - persistence execution of PIVY , side - loaded into a legitimate Samsung application . PIVY¡¯s use of DLL side - loading to abuse Samsung tools is not new , and has been reported previously by Palo Alto . In 2016 it was used to attack pro - democratic activists in Hong Kong , most probably by Chinese threat actors . "
"OceanLotus Attacks to Indochinese Peninsula","indicates","OceanLotus","PRODUCT","three","CARDINAL","According to this batch of resume samples , we conducted homologous sample correlation for these three macro documents , combined with various dimensions , and .nally found a large number of exclusive malicious macro samples of OceanLotus . "
"Magecart Skimming Attack Targets Mobile Users of Hotel Chain Booking Websites","hasattacklocation","abuse.ch","ORG","Canada","GPE","Domain With special thanks to our colleagues at abuse.ch and The Shadowserver Foundation for helping totake down the Magecart domain Related Posts : FIN6 Compromised E - commerce Platform via Magecart to Inject Credit Card Skimmers IntoThousands of Online Shops Mirrorthief Group Uses Magecart Skimming Attack to Hit Hundreds of Campus Online Storesin US and Canada Learn how to protect Enterprises , Small Businesses , and Home Users from ransomware : ENTERPRISE . "
"huge-fan-of-your-work-intelligence-report","hasattacklocation","OPM","ORG","China","GPE","Further reporting tied a breach at United Airlines to the same group that perpetrated Anthem and OPM , reaffirming that those actors had interests in aviation as well.33 It is likely that the DoJ indictments provided yet another piece to this complicated puzzle that saw the pilfering of the data of millions of cleared U.S. government workers funneled to China , a veritable intelligence gold - mine for recruiting potential future spies . "
"Buckeye_ Espionage Outfit Used Equation Group Tools Prior to Shadow Brokers Leak","hasproduct","the Shadow Brokers","ORG","Flash","PRODUCT","All zero - day exploits known , or suspected , to have been used by this group are for vulnerabilities in Internet Explorer and Flash . Timeline of attacks Beginning in August 2016 , a group calling itself the Shadow Brokers began releasing tools it claimed to have originated from the Equation Group . "
"APT-C-38_en_google_translate","hasproduct","Outlook   11","ORG","FireFox","PRODUCT","Get account password information for FireFox , Chrome , IE , Opera , Safari , Thunder.bird , Outlook 11 Get bookmark information for FireFox , Chrome , IE , Opera , Safari 12 "
"Operation Soft Cell_ A Worldwide Campaign Against Telecommunications Providers","hasattacklocation","Operation Soft Cell","ORG","China","GPE","When it comes to attributing Operation Soft Cell , we are unable to achieve 100 % certainty with regard to the identity of the threat actor . However , based on our interpretation of the data , we conclude with a high level of certainty that : The threat actor behind Operation Soft Cell is likely state - sponsored . The threat actor is af.liated with China . "
"Latest Spam Campaigns from TA505 Now Using New Malware Tools Gelup and FlowerPippi","hasattacklocation","Gelup","ORG","Saudi Arabia","GPE","Our in - depth analysis of the Gelup malware andFlowerPippi backdoor , including their infection chains and C&C communication , is detailed in our technical brief . Targeting the UAE TA505 targeted Middle Eastern countries in a June 11 campaign that delivered more than 90 % of the totalspam emails to the UAE , Saudi Arabia , and Morroco . "
"PKPLUG_ Chinese Cyber Espionage Group Attacking Asia","hasattacklocation","PKPLUG","ORG","the Southeast Asia region","LOC","Unit 42 incorporates these .ndings , together with our own , under the moniker PKPLUG and continue to track accordingly . It¡¯s not entirely clear as to the ultimate objectives of PKPLUG , but installing backdoor Trojan implants on victim systems , including mobile devices , infers tracking victims and gathering information is a key goal . We believe victims lay mainly in and around the Southeast Asia region , particularly Myanmar , Taiwan , Vietnam , and Indonesia ; and likely also in various other areas in Asia , such as Tibet , Xinjiang , and Mongolia . "
"APT40 Examining a China-Nexus Espionage Actor  APT40 Examining a China-Nexus Espionage Actor","hasattacklocation","Chinese","NORP","China","GPE","The actor¡¯s targeting is consistent with Chinese state interests and there are multiple technical artifacts indicating the actor is based in China . "
"APT40 Examining a China-Nexus Espionage Actor  APT40 Examining a China-Nexus Espionage Actor","hasattacklocation","¡°Belt and Road Initiative¡±","ORG","United Kingdom","GPE","China¡¯s ¡ ° One Belt , One Road¡± ( Ò»´øÒ»Â · ) or ¡ ° Belt and Road Initiative¡± ( BRI ) is a $ 1 trillion USD endeavor to build land and maritime trade routes across Asia , Europe , the Middle East , and Africa to develop a trade network that will project China¡¯s influence across the greater region . Figure 1 : Countries and industries targeted . Countries include the United States , United Kingdom , Norway , Germany , Saudi Arabia , Cambodia and Indonesia "
"APT10 Targeted Norwegian MSP and US Companies in Sustained Campaign","hasattacklocation","APT3","ORG","India","GPE","Our research from 2017 concluded that Guangdong ITSEC ( and therefore the MSS ) directed the activities of a company named Boyusec , which was identified as a shell company for APT3 . Suspected Tianjin State Security Bureau headquarters . ( Source : IntrusionTruth ) The December APT10 indictment noted that the group¡¯s malicious activities breached at least 45 companies and managed service providers in 12 countries , including Brazil , Canada , Finland , France , Germany , India , Japan , Sweden , Switzerland , the United Arab Emirates , the United Kingdom , and the United States . "
"China-Based APT Mustang Panda Targets Minority Groups, Public and Private Sector Organizations","hasattacklocation","RCSS","ORG","Thailand","GPE","The RCSS , also referred to as Shan State Army ( SSA ) , is a government / political organization that is headquartered in Loi Tai Leng , Southern Shan state , in[8 ] present - day Myanmar ( Burma ) , bordering Thailand . "
"ESET_Okrum_and_Ketrican","indicates","EXE  Stage 1","PRODUCT","seven","CARDINAL","At the time of this publication , ESET systems have detected seven different versions of the loader component and two versions of the installer , although the functionality remained the same . We have not been able to find the original attack vector and dropper of the malware , but we have identified several components used in the Okrum malware : . An optional stage 0 loader . Stage 1 loader . An installer component . A PNG file with an embedded backdoor Table 1 lists the analyzed Okrum backdoor components . SHA-1 PE Timestamp File extension Comment F42A9D85ABE04E721461FE2B52DDC9E0EA411D9E - PNG PNG image with embedded backdoor 8D7E503D972C03C0F87F2D6F6EF65F1381D21BC6 2016 - 01 - 11 EXE Stage 1 loader with embedded backdoor AD740FD11688B2B39072C7024679CC22878E2619 2016 - 01 - 20 EXE Stage 1 loader with embedded backdoor 1CDC632E0A26F39E527ACF7B1CDECD829A6A2B3D 2016 - 11 - 16 DLL Stage 1 loader A426BCC6317F0D49F0F0B68091E8161C512E22C3 2016 - 11 - 16 EXE Installer 38299BCF0BA25E331939683597F161A3D7121A26 2016 - 12 - 19 EXE Stage 1 loader F0E2C3AF0297C80C0A14E95E151FC7DC319ACFC3 2016 - 12 - 19 EXE Installer 371B14F8BFD9B5DB098139E7FE2EBD4381CB259C 2017 - 08 - 07 EXE Stage 0 loader 1D271F22798313650C91C6FC34551CC8492A2019 2017 - 08 - 08 EXE Stage 1 loader 48F8BAFB334C6980FB578C09D7297A4B7F5E09E2 2017 - 08 - 09 EXE Stage 1 loader 5FBAFB71CFDF0C93E19882630D05F37C1F756CBF 2017 - 09 - 15 EXE Stage 1 loader 3.1.1 . "
"Registers as “Default Print Monitor”, but is a malicious downloader. Meet DePriMon","indicates","Arabic","LANGUAGE","the Middle East","LOC","DePriMon was detected in a private company , based in Central Europe , and at dozens of computers in the Middle East . Some of the domain names used as C&C servers contain Arabic words , which gives an indication of a region.speci.c campaign . "
"Iranian-Nation-State-APT-Leak-Analysis-and-Overview","hasattacklocation","Skyward","ORG","Saudi Arabia","GPE","Query on Skyward 's activity . The Turkish police database . Cooperation with these targets ' attack groups . o Examine Israir 's databases . o Examining an insurance company 's databases in Saudi Arabia o Examining RTA 's databases from the UAE The next page contains an R&D clause , with details on measures taken before attacks , preliminary research , and possible attack vectors . "
"APT10 Targeted Norwegian MSP and US Companies in Sustained Campaign","hasattacklocation","IntrusionTruth","ORG","the United Arab  Emirates","GPE","( Source : IntrusionTruth ) The December APT10 indictment noted that the group¡¯s malicious activities breached at least 45 companies and managed service providers in 12 countries , including Brazil , Canada , Finland , France , Germany , India , Japan , Sweden , Switzerland , the United Arab Emirates , the United Kingdom , and the United States . "
"ESET_Operation_Ghost_Dukes","hasattacktime","MiniDuke","ORG","August 17, 2018","DATE","As highlighted in section 3.2 , the most recent versions of the MiniDuke backdoor have a lot of code similarities with earlier versions , such as the sample with SHA-1 of 86EC70C27E5346700714DBAE2F10E168A08210E4 , described by Kaspersky researchers in 2014 [ 21 ] . Our analysis is based on the sample with SHA-1 B05CABA461000C6EBD8B237F318577E9BCCD6047 , compiled on August 17 , 2018 . "
"GALLIUM_ Targeting global telecom","hasproduct","Microsoft","ORG","Defender","PRODUCT","Read the full report in your Microsoft Defender ATP portal . "
"EvilGnome_ Rare Malware Spying on Desktop Users","hasproduct","Gamaredon Group","ORG","Linux","PRODUCT","We proceeded to scan for this network .ngerprint under EvilGnome¡¯s host provider and we identi.ed two additional servers with domain names similar to the naming pattern of Gamaredon domains ( the use of the .space TTLD and ddns ): 185.158.115.44 - > kotl.space 185.158.115.154 - > clsass.ddns.net Tool Similarities Gamaredon Group does not use any known Linux implants . "
"Rancor_ Cyber Espionage Group Uses New Custom Malware to Attack Southeast Asia","indicates","Chrome.vbs","PRODUCT","six seconds","TIME","If the module that loads the sample is named myapp.exe the module will exit Once loaded , it sleeps for six seconds Looks for a Windows pipe named \\.\pipe\_kernel32.dll.ntdll.dll.user32.dll Looks for a Windows device named \Device\acpi_010221 Creates the following registry key HKEY_CLASSES_ROOT\CDO.SS_NNTPOnPostEarlySink.2 Two DWORD values named IDX and Ver . Saves encrypted data at these keys The encryption routine to decrypt the embedded payload is MS_ENH_RSA_AES_PROV Rancor VBScript In July 2019 , we discovered an interesting VBScript named Chrome.vbs ( SHA256 : 0C3D4DFA566F3064A8A408D3E1097C454662860BCACFB6675D2B72739CE449C2 ) associated with the Rancor group . "
"Buckeye_ Espionage Outfit Used Equation Group Tools Prior to Shadow Brokers Leak","hasproduct","the past three years","DATE","Python","PRODUCT","Symantec has found multiple versions of the malware , including a C++ version , a compiled Python version ( using py2exe ) , and a PowerShell version . Over the past three years , Filensfer has been deployed against organizations in Luxembourg , Sweden , Italy , the UK , and the U.S. Targets included organizations in the telecoms , media , and manufacturing sectors . "
"Latest Spam Campaigns from TA505 Now Using New Malware Tools Gelup and FlowerPippi","hasattacklocation","FlawedAmmyy","ORG","Argentina","GPE","The tool also usesthe packer of FlawedAmmyy , a remote access trojan , from previous campaigns . TA505 is also usingFlowerPippi ( Backdoor . Win32.FLOWERPIPPI.A ) , a new backdoor that we found them using in theircampaigns against targets in Japan , India , and Argentina . "
"huge-fan-of-your-work-intelligence-report","hasproduct","TURBINE","ORG","PANDA¡¯","PRODUCT","As described in the ZHANG indictment , on 26 February 2014 , one day after the release of our ¡ ° French Connection¡± blog publicly exposed some of TURBINE PANDA¡¯s operations , intel officer XU texted his JSSD counterpart , cyber director CHAI , asking if the domain ns24.dnsdojo.com was related to their cyber operations . "
"ESET_Okrum_and_Ketrican","indicates","Ntmssvc","PRODUCT","two","CARDINAL","The component can be executed in two modes , determined by the command line argument ( install or uninstall ) . It creates or removes a service called Ntmssvc that mimics the legitimate Removable Storage service but in fact , it loads one of the Okrum loaders on each system startup . "
"ESET-LightNeuron","hasproduct","VirtualBox","ORG","Windows Driver Signature Enforcement","PRODUCT","Some of their tools stand out for their complexity , such as the Snake rootkit , which relies on a vulnerable VirtualBox driver to bypass Windows Driver Signature Enforcement [ 15 ] . "
"ESET_Operation_Ghost_Dukes","hasattacktime","Operation Ghost","WORK_OF_ART","October","DATE","Figure 4 // Reddit post containing an encoded C&C URL Figure 5 presents the timeline of Operation Ghost . As it is based on ESET telemetry , it might be only a partial view of a broader campaign . .¡ã .. .¡ã . ¡ ¦ .¡ã.6 September July September First known Post on Reddit First known deployment compilation timestamp containing an encoded in the wild of a FatDuke of PolyglotDuke C&C URL sample .¡ã. August .¡ã .. .¡ã .. .¡ã.8 First known deployment October June October in the wild of a RegDuke sample Publication Latest known FatDuke Last Twitter account of this report sample deployed registered by the Dukes in the wild Figure 5 // Timeline of Operation Ghost 3.2 Attribution to the Dukes "
"PKPLUG_ Chinese Cyber Espionage Group Attacking Asia","hasattacklocation","PKPLUG","ORG","Indonesia","GPE","It¡¯s not entirely clear as to the ultimate objectives of PKPLUG , but installing backdoor Trojan implants on victim systems , including mobile devices , infers tracking victims and gathering information is a key goal . We believe victims lay mainly in and around the Southeast Asia region , particularly Myanmar , Taiwan , Vietnam , and Indonesia ; and likely also in various other areas in Asia , such as Tibet , Xinjiang , and Mongolia . "
"Elfin Relentless Espionage Group Targets Multiple Organizations in Saudi Arabia and US","hasattacklocation","Elfin","ORG","the United States","GPE","The Elfin espionage group ( aka APT33 ) has remained highly active over the past three years , attacking at least 50 organizations in Saudi Arabia , the United States , and a range of other countries . "
"cta-2019-0206","hasattacktime","Citrix","ORG","around August 17, 2018","DATE","Interestingly , in all three attacks , the targeting of Citrix remote desktops was a common thread . Additionally , the same DLL sideloading technique observed in the Visma attack was used , and many of the tools deployed by the attackers shared naming similarities as well ( 1.bat , cu.exe , ss.rar , r.exe , pd.exe ) . Most interestingly , Rapid7 observed the use of the Notepad++ updater gup.exe as a legitimate executable to sideload a malicious DLL ( libcurl.dll ) in order to deploy a variant of the UPPERCUT backdoor ( also known as ANEL ) . APT10 used this approach to deploy UPPERCUT when targeting Japanese corporations in July 2018 . The Visma Attack APT10 actors gained initial access to the Visma network around August 17 , 2018 . "
"blog_Sharpening the Machete","hasattacklocation","Machete","ORG","2","CARDINAL","The Machete group sends very speci.c emails directly to its victims , and these change from target to target . These emails contain either a link to , or an attachment of , a compressed self - extracting archive that runs the malware and opens a document that serves as a decoy . Figure 2 is a typical PDF .le displayed to a potential victim during compromise . "
"OceanLotus Attacks to Indochinese Peninsula","hasattacklocation","Eternal Blue","ORG","Vietnam","GPE","Exploit Vulnerabilities of Eternal Blue We also found that OceanLotus used the "" Eternal blue "" series of vulnerabilities to target companies in Vietnam that provided software to the government . Website : https://www.tandan.com.vn/portal/home/default.aspx TAN DAN JSC for Vietnam 's software company . "
"Revenge RAT targeting users in South America","hasproduct","Microsoft","ORG","Word","PRODUCT","There are two important macros present in the BIN file : ¡ ° Macro 1¡± kills the Microsoft Word process ¡ ° winword.exe¡± and ¡ ° Macro2¡± downloads and executes the PowerShell code present at the URL ¡ ° hxxp://azulviagens[.]online / A.txt¡± in memory . "
"cta-2019-0206","hasattacktime","Norwegian","NORP","late 2018.   6","DATE","The targeting of a Norwegian MSP , which enabled potential access to an extensive customer base . We believe that the APT10 targeting of Visma is an extension of their 2017 Cloud Hopper operation ( which victimized some of the world¡¯s largest MSPs ) and has continued into late 2018 . 6 . "
"New Network Vermin from OceanLotus","indicates","Ratsnif","PRODUCT","four","CARDINAL","We delved into four distinct Ratsnif samples , three of them developed in 2016 , the fourth created during the latter half of 2018 . "
"cta-2019-0206","hasattacklocation","Citrix","ORG","China","GPE","Throughout August 2018 , the APT10 actors regularly logged in to the Visma network via accessible Citrix servers using two valid user accounts . The times of the logins were consistent with a GMT+8 timezone , indicative of typical Tianjin , China working hours . "
"Emissary Panda Attacks Middle East Government Sharepoint Servers","hasproduct","Microsoft¡¯s System Center 2012 Con.guration Manager","ORG","Sublime Text","PRODUCT","The commands available within the HyperBro tool¡¯s command handler Unknown Sideloaded Payloads Table 2 and 4 above include two legitimate executables used for DLL sideloading , speci.cally the plugin_host.exe application for Sublime Text and the CreateMedia.exe application from Microsoft¡¯s System Center 2012 Con.guration Manager . "
"OceanLotus Attacks to Indochinese Peninsula","indicates","OHNMacro","PRODUCT","three","CARDINAL","Some use the technique of converting macro code to a 1 - pound font hidden in a document ( later upgraded to a white 1 - pound font , internally named OHNMacro for RedDrip ) . In the following sections we will examine each of these three macro usage analyses in detail . "
